{
  "format": "dicom-series-v1",
  "client_version": "0.6.1",
  "deidentification": {
    "policy_id": "scaling-neuro.dicom-deidentification",
    "policy_version": "2.0.0"
  },
  "series": [
    {
      "series_archive_id": "7c2a5f77f3ab6c6d9e011234",
      "series_id": "3d5a987c014de62f9a011234",
      "subject_id": "9c48102a77e3500f3a011234",
      "session_id": "6a138b712e4d11af9a011234",
      "protocol_group_id": "bb1c4ef23b97d8029a011234",
      "dicom_count": 300,
      "series_kind": "functional_epi",
      "archive_route": "functional-epi-v1",
      "pixel_data_policy": "scanner-native-not-defaced",
      "archive": {
        "format": "dicom-tar-zstd",
        "relative_key": "7c2a5f77f3ab6c6d9e011234/dicom.tar.zst",
        "size": 104857600,
        "sha256": "aaaaaaaaaaaaaaaaaaaaaaaaaaaaaaaaaaaaaaaaaaaaaaaaaaaaaaaaaaaaaaaa"
      }
    }
  ]
}
